book,chapter,verse,text,topic_0,topic_1,topic_2,topic_3,topic_4,topic_5,dominant_topic
Isaiah,47.0,10.0,thou hast trust thy wickedness thou hast say seeth thy wisdom thy knowledge hath pervert thee thou hast say thine heart,0.012908626431131763,0.013044080723566838,0.9352440291741327,0.012887651744977639,0.012931731641671183,0.012983880284519734,2
Isaiah,47.0,11.0,shall evil come thee thou shalt know riseth mischief shall fall thee thou shalt able desolation shall come thee suddenly thou shalt know,0.011951753864313065,0.9401820998642968,0.011936305879932198,0.01200524732216197,0.011957093785780337,0.011967499283515709,1
Isaiah,47.0,12.0,stand thine enchantment multitude thy sorcery thou hast labour thy youth thou shalt able profit thou may prevail,0.012851615333687335,0.012933016286474959,0.01316921104341855,0.9350555037782934,0.013052076783367565,0.012938576774758313,3
Isaiah,47.0,13.0,thou art weary multitude thy counsel let astrologer stargazer monthly prognosticator stand save thee thing shall come thee,0.016724193680764186,0.9160219106123376,0.016758216778831818,0.016909091696499484,0.016808637664837856,0.016777949566729143,1
Isaiah,47.0,14.0,behold shall stubble fire shall burn shall deliver power flame shall coal warm fire sit,0.0168818875413861,0.016683685562120458,0.91623574877903,0.016728030646591965,0.01676324954295321,0.016707397927918196,2
Isaiah,47.0,15.0,shall unto thee thou hast labour thy merchant thy youth shall wander quarter shall save thee,0.748131664783198,0.02092863731644036,0.16782443844784795,0.020947365751892485,0.021073859110991428,0.021094034589629603,0
Isaiah,48.0,1.0,hear ye o house jacob call israel come forth water judah swear lord mention god israel truth righteousness,0.27553662808790674,0.16354119976967535,0.010539286643657065,0.010459738840540782,0.5294379298802684,0.010485216777951622,4
Isaiah,48.0,2.0,holy city stay god israel lord host,0.02104006574352667,0.02098321392931727,0.8950066393571686,0.021002107407996875,0.02104435502536662,0.020923618536623917,2
Isaiah,48.0,3.0,declare thing beginning go forth mouth shewed suddenly come pass,0.016726201046854735,0.9161687211551551,0.016745645575785093,0.01683019717253789,0.016738019015329977,0.016791216034337163,1
Isaiah,48.0,4.0,know thou art obstinate thy neck iron sinew thy brow brass,0.027886810392587547,0.027841293892245128,0.027851131085665302,0.027820887640111716,0.8606800762482114,0.027919800741178873,4
Isaiah,48.0,5.0,beginning declare thee come pass shew thee lest thou shouldest idol hath graven image molten image hath command,0.012084403991538333,0.939988125989015,0.011951160489910944,0.011946560146899238,0.011949926004456459,0.01207982337817995,1
Isaiah,48.0,6.0,thou hast hear ye declare shew thee new thing time hide thing thou didst know,0.013914296433958927,0.9301939421977714,0.014020264575774776,0.013893895296534795,0.01404366245408814,0.013933939041871945,1
Isaiah,48.0,7.0,create beginning day thou heardest lest thou shouldest behold know,0.020886540026687286,0.895188482733286,0.020961017424395722,0.020905140807377313,0.02107375712419777,0.020985061884055908,1
Isaiah,48.0,8.0,yea thou heard yea thou knew yea time thine ear open know thou would deal treacherously wast call transgressor womb,0.011907804712383353,0.44062166945214937,0.011946202698746546,0.011975673444877318,0.012003932568627982,0.5115447171232155,5
Isaiah,48.0,9.0,name sake defer anger praise refrain thee cut thee,0.027938716728523518,0.8596625714720314,0.027943586896377895,0.028087727979086374,0.028201574155078867,0.02816582276890215,1
Isaiah,48.0,10.0,behold refine thee silver choose thee furnace affliction,0.023956679988458917,0.024049003984873845,0.24327950629968745,0.024085331479423433,0.023991234313560077,0.6606382439339963,5
Isaiah,48.0,11.0,sake sake pollute glory unto,0.033357164166737466,0.033531380763698805,0.8326473216053867,0.033386767006331086,0.03348038614690331,0.03359698031094262,2
Isaiah,48.0,12.0,hearken unto o jacob israel call,0.04177863106393704,0.042143586465641855,0.04220623688947898,0.04171005550744732,0.7901812757312493,0.04198021434224557,4
Isaiah,48.0,13.0,hand hath lay foundation earth right hand hath span heaven unto stand,0.016721566784288856,0.016698848374031485,0.016830602456315392,0.9162284886291502,0.01677076048101387,0.016749733275200338,3
Isaiah,48.0,14.0,ye assemble hear hath declare thing lord hath love pleasure babylon arm shall chaldean,0.015400148999648304,0.015396325689321326,0.015185697273911655,0.01516257491859684,0.9236538289131359,0.015201424205385998,4
Isaiah,48.0,15.0,speak yea call bring shall way prosperous,0.03347563540197496,0.8318615796465456,0.033618303516989384,0.033650456845924395,0.033543749665884796,0.033850274922681035,1
Isaiah,48.0,16.0,come ye near unto hear ye speak secret beginning time lord god spirit hath send,0.01394545205239197,0.603529317904014,0.013963755423486159,0.013934604798649348,0.3406771952532076,0.013949674568250955,1
Isaiah,48.0,17.0,saith lord thy redeemer holy israel lord thy god teacheth thee profit leadeth thee way thou shouldest,0.013939595916553563,0.014054497506003044,0.30819189836394834,0.013980931400966816,0.6358737405180804,0.013959336294447846,4
Isaiah,48.0,18.0,o thou hadst hearken commandment thy peace river thy righteousness wave sea,0.01869849895139641,0.018557114232879486,0.018689455603098627,0.018612185510704926,0.01866096091757769,0.9067817847843428,5
Isaiah,48.0,19.0,thy seed sand offspring thy bowel like gravel thereof cut destroy,0.018678424063502556,0.018550801674117823,0.018749791623602116,0.018735027231724842,0.018799540290607392,0.9064864151164453,5
Isaiah,48.0,20.0,ye forth babylon flee ye chaldean voice singe declare ye tell utter end earth ye lord hath redeem servant jacob,0.2196539811498772,0.2806246476709652,0.010497192773933833,0.010442881534413646,0.39054874208110685,0.08823255478970332,4
Isaiah,48.0,21.0,thirst lead desert cause water flow rock clave rock water gush,0.564779072833587,0.016769895187773817,0.016840984594365338,0.016711560244945755,0.016857964128828857,0.36804052301049933,0
Isaiah,48.0,22.0,peace saith lord unto wicked,0.0334536276826474,0.03338794937702977,0.832434044292123,0.03371328919829716,0.033590537312919264,0.03342055213698344,2
Isaiah,49.0,1.0,listen o isle unto hearken ye people far lord hath call womb bowel mother hath mention,0.016791912327094465,0.016830879694646562,0.6901197305345588,0.016713526516661952,0.24271304021242432,0.016830910714613952,2
Isaiah,49.0,2.0,hath mouth like sharp sword shadow hand hath hide polished shaft quiver hath hide,0.9156788177163749,0.016796690557650717,0.01683248678870156,0.0169762705354533,0.01682760633612061,0.016888128065698824,0
Isaiah,49.0,3.0,say unto thou art servant o israel glorify,0.027777928286001466,0.028466919678524962,0.028019128670808677,0.027958214529298097,0.8597576382281579,0.028020170607208836,4
Isaiah,49.0,4.0,say labour vain spend strength nought vain surely judgment lord work god,0.01311757084494053,0.012956676888737775,0.012899452774043172,0.14078318774258836,0.8072770537892695,0.012966057960420633,4
Isaiah,49.0,5.0,saith lord form womb servant bring jacob israel gather shall glorious eye lord god shall strength,0.0111609841772908,0.011182863115031604,0.011246553558453316,0.01115920911697717,0.9441078208764905,0.011142569155756593,4
Isaiah,49.0,6.0,say light thing thou shouldest servant raise tribe jacob restore preserve israel thee light gentile thou mayest salvation unto end earth,0.00933073431871202,0.613441651467814,0.34926834125777706,0.009331966946902817,0.009340762260141222,0.00928654374865305,1
Isaiah,49.0,7.0,saith lord redeemer israel holy man despiseth nation abhorreth servant ruler king shall arise prince shall worship lord faithful holy israel shall choose thee,0.00839960701721315,0.008428658631695918,0.9579209895358899,0.00836839199927023,0.008460016498463948,0.00842233631746685,2
Isaiah,49.0,8.0,saith lord acceptable time hear thee day salvation help thee preserve thee thee covenant people establish earth cause inherit desolate heritage,0.4339424256836514,0.5285216559109036,0.009419239121896586,0.009374211185441635,0.009388100349713087,0.009354367748393887,1
Isaiah,49.0,9.0,thou mayest prisoner forth darkness shew shall feed way pasture shall high place,0.5385022660192936,0.40015789102002863,0.015307001583463379,0.01536801078589469,0.015395209695784862,0.01526962089553509,0
Isaiah,49.0,10.0,shall hunger thirst shall heat sun smite hath mercy shall lead spring water shall guide,0.9161923430923696,0.016703984229746883,0.01668064212925791,0.01687206098147809,0.016834944549771344,0.01671602501737631,0
Isaiah,49.0,11.0,mountain way highway shall exalt,0.03346742830681765,0.03362388484873576,0.033507023159737415,0.2989806248881255,0.033657833360511265,0.5667632054360724,5
Isaiah,49.0,12.0,behold shall come far lo north west land sinim,0.5693182487344557,0.021000863111564686,0.021001975590503163,0.0210732433595933,0.34655173451847443,0.02105393468540875,0
Isaiah,49.0,13.0,sing o heaven joyful o earth break forth singe o mountain lord hath comfort people mercy afflict,0.01208566449291952,0.012126636912711921,0.7470969391109513,0.012018747179350628,0.011976631226153153,0.20469538107791355,2
Isaiah,49.0,14.0,zion say lord hath forsake lord hath forget,0.023994035301627685,0.024084387396553775,0.3918532835592059,0.0240138867861293,0.02413948408317184,0.5119149228733115,5
Isaiah,49.0,15.0,woman forget suck child compassion son womb yea forget forget thee,0.016673006772234652,0.016766327112417934,0.016749608841430653,0.016690072064718654,0.016802468631388283,0.9163185165778098,5
Isaiah,49.0,16.0,behold grave thee palm hand thy wall continually,0.02808104461398278,0.02811504614499049,0.028185590234540685,0.8595523882158982,0.028079380162732308,0.027986550627855485,3
Isaiah,49.0,17.0,thy child shall haste thy destroyer thee waste shall forth thee,0.0333576164924186,0.033969770866682666,0.8319062327395383,0.03379320231473993,0.0333710845475337,0.033602093039086955,2
Isaiah,49.0,18.0,lift thine eye round behold gather come thee live saith lord thou shalt surely clothe thee ornament bind thee bride doeth,0.009291553177557435,0.009314485170200943,0.009298532148633683,0.009314123568306297,0.9534811340067654,0.00930017192853626,4
Isaiah,49.0,19.0,thy waste thy desolate place land thy destruction shall narrow reason inhabitant swallow thee shall far away,0.015294078056098734,0.015304094751208981,0.015248469816943229,0.015263786317544704,0.015200941009753319,0.9236886300484509,5
Isaiah,49.0,20.0,child thou shalt thou hast lose shall thine ear place strait place dwell,0.016738203020812952,0.016898404639348615,0.016861710229134717,0.016745512680343102,0.9159264470113305,0.016829722419030187,4
Isaiah,49.0,21.0,shalt thou thine heart hath beget see lose child desolate captive remove fro hath bring behold leave,0.011980482414168827,0.011993341751508568,0.40703060957956805,0.2985895099924842,0.012019976617589018,0.25838607964468135,2
Isaiah,49.0,22.0,saith lord god behold lift hand gentile set standard people shall bring thy son arm thy daughter shall carry shoulder,0.00990534526512911,0.009901905551531998,0.4486637869248427,0.009913377268408638,0.5117458690273207,0.00986971596276684,4
Isaiah,49.0,23.0,king shall thy nursing father queen thy nursing mother shall bow thee face earth lick dust thy foot thou shalt know lord shall ashamed wait,0.01196590581283491,0.012000326398083632,0.9400650233179486,0.011998863706098142,0.011980453757532828,0.011989427007501786,2
Isaiah,49.0,24.0,shall prey take mighty lawful captive deliver,0.03352220193754032,0.033376662457833474,0.8325405885091883,0.03363515659781968,0.033523950751240976,0.033401439746377146,2
Isaiah,49.0,25.0,saith lord captive mighty shall take away prey terrible shall deliver contend contendeth thee save thy child,0.013987610764978268,0.12428938006394578,0.8197560533228138,0.014009529361662762,0.013997189442759171,0.013960237043840256,2
Isaiah,49.0,26.0,feed oppress thee flesh shall drunken blood sweet wine flesh shall know lord thy saviour thy redeemer mighty jacob,0.011168857410899107,0.011140320249325767,0.01134819548153356,0.01112905835932866,0.9440722724329635,0.011141296065949467,4
Isaiah,50.0,1.0,saith lord bill mother divorcement away creditor sell behold iniquity ye sell transgression mother away,0.013953587606719697,0.013948578992548068,0.9301601522631188,0.014013471867225246,0.013957795017387203,0.01396641425300109,2
Isaiah,50.0,2.0,wherefore come man call answer hand shorten redeem power deliver behold rebuke dry sea river wilderness fish stinketh water dieth thirst,0.28954432421706666,0.008399191630495843,0.008398223245776116,0.008385712952971412,0.008368764666834706,0.6769037832868553,5
Isaiah,50.0,3.0,clothe heaven blackness sackcloth covering,0.03339564808515632,0.03333351058197961,0.03373782735862475,0.033410234395248685,0.8326632018180119,0.033459577760978895,4
Isaiah,50.0,4.0,lord god hath give tongue learn know speak word season weary wakeneth morning morning wakeneth ear hear learn,0.012077701160419216,0.4711650968930491,0.011977095492646595,0.011949332695421486,0.01200367901430743,0.4808270947441562,5
Isaiah,50.0,5.0,lord god hath open ear rebellious turn away,0.020955842370975277,0.4680142145755399,0.021111330700873503,0.44789158675785706,0.021041157578395777,0.020985868016358496,1
Isaiah,50.0,6.0,give smiter cheek pluck hair hide face shame spit,0.03351752541334939,0.03344351549994259,0.5986049319088733,0.2676439081575769,0.03338286087479453,0.03340725814546323,2
Isaiah,50.0,7.0,lord god help shall confound set face like flint know shall ashamed,0.01532857546406411,0.015222312400015033,0.9236841507169684,0.015274231166975969,0.015292630796283537,0.015198099455692957,2
Isaiah,50.0,8.0,near justifieth contend let stand adversary let come near,0.018562749304777342,0.9070305665632347,0.018557422875387836,0.01873801430698754,0.018551069879396462,0.018560177070216153,1
Isaiah,50.0,9.0,behold lord god help shall condemn lo shall wax old garment moth shall eat,0.45627429546593423,0.013941521118795394,0.013979157092126165,0.013935909689301166,0.48789354585530875,0.013975570778534237,4
Isaiah,50.0,10.0,feareth lord obeyeth voice servant walketh darkness hath light let trust lord stay god,0.35317439215531826,0.014005870937997527,0.014018808591864811,0.19819096152400378,0.4066861055943736,0.01392386119644203,4
Isaiah,50.0,11.0,behold ye kindle fire compass spark walk light fire spark ye kindle shall ye hand ye shall lie sorrow,0.014096481027348886,0.013995801820994186,0.014160266462626431,0.014107457763060252,0.013952373700614952,0.9296876192253553,5
Isaiah,51.0,1.0,hearken ye follow righteousness ye seek lord look unto rock ye hew hole pit ye digge,0.01403157865673853,0.0139595802387037,0.014020878434792987,0.01404068120797713,0.013970379182707543,0.9299769022790801,5
Isaiah,51.0,2.0,look unto abraham father unto sarah bare call bless increase,0.023818962012091757,0.024087201190422756,0.024330477656953137,0.023822479997483582,0.02429270605357437,0.8796481730894744,5
Isaiah,51.0,3.0,lord shall comfort zion comfort waste place wilderness like eden desert like garden lord joy gladness shall find thanksgive voice melody,0.2891828130506685,0.26803906104369635,0.009342495414579374,0.009340013579656775,0.4147699316223767,0.0093256852890223,4
Isaiah,51.0,4.0,hearken unto people ear unto o nation law shall proceed judgment rest light people,0.28314323353076626,0.6557246496887134,0.015362987538935344,0.015331425573379428,0.015204925603676847,0.015232778064528812,1
Isaiah,51.0,5.0,righteousness near salvation go forth arm shall judge people isle shall wait arm shall trust,0.014167070230945326,0.013988477549406828,0.9299601843038765,0.013970272718535806,0.013969512693653631,0.013944482503581832,2
Isaiah,51.0,6.0,lift eye heaven look earth beneath heaven shall vanish away like smoke earth shall wax old like garment dwell shall die like manner salvation shall righteousness shall abolish,0.22385244596067513,0.007286703112356463,0.2706077971999983,0.007308717048335679,0.483636230792291,0.0073081058863434765,4
Isaiah,51.0,7.0,hearken unto ye know righteousness people heart law fear ye reproach man ye afraid reviling,0.015287616107799402,0.015465483302241356,0.015349725031456152,0.01527512691558132,0.015299419928490817,0.9233226287144309,5
Isaiah,51.0,8.0,moth shall eat like garment worm shall eat like wool righteousness shall salvation generation generation,0.013055481082912447,0.012866387569402782,0.0129912981250689,0.012864729289867363,0.9353410314885793,0.01288107244416917,4
Isaiah,51.0,9.0,awake awake strength o arm lord awake ancient day generation old art thou hath cut rahab wound dragon,0.011172609925908652,0.011237548009024448,0.011222461009859264,0.011158015169983649,0.9440069697386141,0.011202396146609877,4
Isaiah,51.0,10.0,art thou hath dry sea water great deep hath depth sea way ransom pass,0.013932587437752069,0.013941106942902588,0.01395415460552476,0.013990176041095828,0.12228137095361773,0.821900604019107,5
Isaiah,51.0,11.0,redeemed lord shall return come singing unto zion everlaste joy shall head shall obtain gladness joy sorrow mourning shall flee away,0.009880566680917541,0.00985271391051487,0.00987175180888108,0.009857875346723438,0.009848680428141207,0.9506884118248218,5
Isaiah,51.0,12.0,comforteth art thou thou shouldest afraid man shall die son man shall grass,0.016683633643397505,0.016966280944081463,0.016711850583401227,0.016708854691785808,0.016897756314207847,0.9160316238231262,5
Isaiah,51.0,13.0,forgettest lord thy maker hath stretch forth heaven lay foundation earth hast fear continually day fury oppressor ready destroy fury oppressor,0.008814866712061725,0.008826954856989602,0.6836602724473866,0.28102993273513766,0.008830070744786393,0.008837902503637985,2
Isaiah,51.0,14.0,captive exile hasteneth loose die pit bread fail,0.024096553988074376,0.02380975570626754,0.023945471323291508,0.0244674425166259,0.8796056078446749,0.024075168621065773,4
Isaiah,51.0,15.0,lord thy god divide sea wave roar lord host,0.0186096354983486,0.01865737481778266,0.01873104915170544,0.9065627973972724,0.018809330092942902,0.018629813041948166,3
Isaiah,51.0,16.0,word thy mouth cover thee shadow hand plant heaven lie foundation earth unto zion thou art people,0.012048807750573725,0.012055188624455556,0.9398546560892325,0.01204150132712886,0.011999725287094544,0.012000120921514887,2
Isaiah,51.0,17.0,awake awake stand o jerusalem hast drunk hand lord cup fury thou hast drunken dreg cup tremble wrung,0.010438389095413109,0.010482614779741333,0.9476440240692603,0.010481596603580622,0.010497141601511379,0.010456233850493381,2
Isaiah,51.0,18.0,guide son hath bring forth taketh hand son hath bring,0.018809275672956236,0.376740100835241,0.018782725064321198,0.018628988900067645,0.5484086803434234,0.018630229183990706,4
Isaiah,51.0,19.0,thing come unto thee shall sorry thee desolation destruction famine sword shall comfort thee,0.020882178669486155,0.8954701435766952,0.020859494863101145,0.020924015979434444,0.020879910139188104,0.02098425677209485,1
Isaiah,51.0,20.0,thy son faint lie head street wild bull net fury lord rebuke thy god,0.012894436120496136,0.2838516274305668,0.2814568673290795,0.012872719684308908,0.012934378648847897,0.3959899707867007,5
Isaiah,51.0,21.0,hear thou afflict drunken wine,0.033348582639389966,0.03430409000315125,0.03356966598948522,0.03344408314191805,0.8316905208831731,0.03364305734288244,4
Isaiah,51.0,22.0,saith thy lord lord thy god pleadeth cause people behold take thine hand cup tremble dreg cup fury thou shalt drink,0.009286938753485914,0.18971677126513617,0.7730093385419825,0.009306746346620086,0.009360005209874876,0.009320199882900466,2
Isaiah,51.0,23.0,hand afflict thee say thy soul bow thou hast lay thy body ground street go,0.015185887119873035,0.015270721728585316,0.25878871993166713,0.015338985588209094,0.015319061491057143,0.6800966241406082,5
Isaiah,52.0,1.0,awake awake thy strength o zion thy beautiful garment o jerusalem holy city henceforth shall come thee uncircumcised unclean,0.01296678831787056,0.5300295991528061,0.4182873614986143,0.01287700253878426,0.012970008136280395,0.012869240355644294,1
Isaiah,52.0,2.0,shake thyself dust arise sit o jerusalem loose thyself band thy neck o captive daughter zion,0.6526497951279333,0.01194833078926839,0.012100066816308748,0.011957301344816764,0.299407870046475,0.01193663587519781,0
Isaiah,52.0,3.0,saith lord ye sell nought ye shall redeem money,0.02404721128852383,0.023866690141289313,0.024112462551614516,0.02388379748792299,0.8800676421582875,0.024022196372362005,4
Isaiah,52.0,4.0,saith lord god people go aforetime egypt sojourn assyrian oppress cause,0.01670771583146588,0.016764389373963875,0.016844269611611444,0.016866464839050143,0.9160665785102885,0.01675058183362011,4
Isaiah,52.0,5.0,saith lord people take away nought rule howl saith lord continually day blaspheme,0.012844770139991092,0.012902939475348405,0.01297177822618886,0.5971422124513063,0.3512239319968992,0.012914367710266213,3
Isaiah,52.0,6.0,people shall know shall know day doth speak behold,0.020958597092520872,0.8949414030678232,0.02098864258424168,0.020956237316908852,0.021039494899029614,0.021115625039475772,1
Isaiah,52.0,7.0,beautiful mountain foot bringeth good tiding publisheth peace bringeth good tiding good publisheth salvation saith unto zion thy god reigneth,0.7340150245058281,0.010453298155349856,0.22408805756213265,0.010440661943563573,0.010512410715387428,0.010490547117738341,0
Isaiah,52.0,8.0,thy watchman shall lift voice voice shall sing shall eye eye lord shall bring zion,0.015277630772174606,0.5762798269848446,0.015300278636240281,0.015180778775709676,0.3625402696552164,0.015421215175814507,1
Isaiah,52.0,9.0,break forth joy sing ye waste place jerusalem lord hath comfort people hath redeem jerusalem,0.21854995635125743,0.7297713628340587,0.012923193511190862,0.01289054997934339,0.012917797553695877,0.012947139770453777,1
Isaiah,52.0,10.0,lord hath bare holy arm eye nation end earth shall salvation god,0.015273924324770647,0.19956358615644168,0.7394168154658438,0.015196578559176475,0.015276780060860777,0.015272315432906653,2
Isaiah,52.0,11.0,depart ye depart ye ye touch unclean thing ye midst ye clean bear vessel lord,0.015196404230842975,0.015426176872115718,0.015254693651412247,0.015199678252033492,0.015268466812821688,0.9236545801807738,5
Isaiah,52.0,12.0,ye shall haste flight lord god israel rereward,0.027854463307528027,0.027884153736168867,0.6471118896373899,0.24098315587772168,0.028078478302805337,0.028087859138386156,2
Isaiah,52.0,13.0,behold servant shall deal prudently shall exalt extoll high,0.027875549350867734,0.028055135335694065,0.027883128011878717,0.027862837781254354,0.8604507911776069,0.027872558342698202,4
Isaiah,52.0,14.0,astonied thee visage mar man form son man,0.033412949860289455,0.03389318059148421,0.03336365369778333,0.033354681119217335,0.03405638730098671,0.831919147430239,5
Isaiah,52.0,15.0,shall sprinkle nation king shall shut mouth tell shall hear shall consider,0.018549677405571167,0.44346090223694457,0.01862834369745975,0.32958709970424127,0.018690113039281503,0.1710838639165016,1
Isaiah,53.0,1.0,hath believe report arm lord reveal,0.027791624386716802,0.02780366453070683,0.8606493882635801,0.027834294882781416,0.02795330636651852,0.02796772156969636,2
Isaiah,53.0,2.0,shall grow tender plant root dry ground hath form comeliness shall beauty desire,0.016810048026781654,0.016802364064127186,0.016752008185397068,0.4405853988588854,0.016862299396830597,0.4921878814679782,5
Isaiah,53.0,3.0,despise reject man man sorrow acquaint grief hide face despise esteem,0.016751574575954466,0.9155564766435161,0.017056279947672254,0.01698944776498022,0.016745523599382976,0.016900697468493684,1
Isaiah,53.0,4.0,surely hath borne grief carry sorrow esteem stricken smitten god afflict,0.016702846974366,0.016788606081842395,0.016783855942240824,0.9160348192360441,0.016899409238041195,0.01679046252746552,3
Isaiah,53.0,5.0,wound transgression bruise iniquity chastisement peace stripe heal,0.02390001203515444,0.0240647063465509,0.02411604876686365,0.02412993798239643,0.8799591546067403,0.023830140262294217,4
Isaiah,53.0,6.0,like sheep go astray turn way lord hath lay iniquity,0.02089340899593774,0.020908378998262492,0.3368943463350038,0.5793068208753376,0.021001437306496853,0.020995607488961527,3
Isaiah,53.0,7.0,oppress afflict open mouth bring lamb slaughter sheep shearer dumb openeth mouth,0.015222335430479485,0.015242902548156011,0.9236198135773687,0.01543283584354954,0.01522162697494845,0.015260485625497994,2
Isaiah,53.0,8.0,take prison judgment shall declare generation cut land living transgression people stricken,0.015523347515087512,0.015304297307193515,0.015303545090921463,0.015276119650939892,0.9233584920046215,0.015234198431236207,4
Isaiah,53.0,9.0,grave wicked rich death violence deceit mouth,0.020857414200745807,0.02087585887628109,0.02085612197990391,0.8956864984010314,0.020870463129484217,0.020853643412553493,3
Isaiah,53.0,10.0,please lord bruise hath grief thou shalt soul offering sin shall seed shall prolong day pleasure lord shall prosper hand,0.011163327655939772,0.01123035334583097,0.011225782030328781,0.011249602014932981,0.9439092113339492,0.011221723619018137,4
Isaiah,53.0,11.0,shall travail soul shall satisfied knowledge shall righteous servant justify shall bear iniquity,0.016861396258842806,0.9157023051627022,0.01685406658795201,0.01684483528645093,0.016868295332159913,0.016869101371892264,1
Isaiah,53.0,12.0,divide portion great shall divide spoil strong hath pour soul unto death number transgressor bare sin intercession transgressor,0.01114699945944615,0.39653435946120835,0.011189270662074846,0.32503595430694177,0.01119368772688762,0.24489972838344112,1
